項次編號,評分等級,認定項目,行政區編號,地址,場所名稱,latitude,longitude
1,2,9,63000050,忠孝東路1段12號,喜來登大飯店,25.044949997703,121.522079967671
2,2,5,63000050,中山南路7號,臺大醫院,38.30156831,140.82517962
3,2,5,63000050,中山南路8號,臺大醫院兒童醫療大樓,38.30156831,140.82517962
4,2,5,63000050,北平東路28號2樓,創世清寒植物人安養院,25.045801012332,121.525361985679
5,2,4,63000050,忠孝東路1段85號,凱撒世貿大樓,25.044200320283,121.526726475696
6,2,4,63000050,忠孝東路1段83號,凱撒花園大樓,25.044323995264,121.526352978091
7,2,4,63000050,杭州南路1段15號,醒吾大樓,25.043140009531,121.526784981381
8,2,4,63000050,忠孝東路2段88號,海華金融大廈,25.042996008435,121.529399967533
9,2,4,63000050,仁愛路2段61、63號,鴻禧大樓,,
10,2,1,63000050,齊東街53巷2號至10號,木造建築物,,
11,2,9,63000050,新生南路1段6號,來來忠孝大樓,25.044023001121,121.532621971114
12,2,9,63000050,中山南路21號,國立中正文化中心,38.30156831,140.82517962
13,2,9,63000050,信義路2段81號,東門市場,25.034654003118,121.526787998866
14,2,9,63000050,臨沂街44巷1號木造建築物,木造建築物,35.1032403,118.3506988
15,2,9,63000050,臨沂街63巷18號對面,木造建築物,,
16,2,9,63000050,臨沂街65巷11號,木造建築物,,
17,2,7,63000050,忠孝東路1段12號,喜來登大飯店附設立體停車塔,25.044949997703,121.522079967671
18,2,7,63000050,忠孝東路2段80號,天裔大廈停車塔,25.043054011205,121.529004006427
19,2,4,63000050,忠孝東路2段123號,兆豐金融大樓,25.042815001236,121.532457015259
20,2,4,63000050,濟南路1段2之2號,中央聯合大樓北棟,25.043175884336,121.519160744682
21,2,4,63000050,徐州路5號,中央聯合大樓南棟,25.042036992983,121.519499012045
22,2,9,63000050,仁愛路1段1號,臺大基礎醫學大樓,23.325069003424,121.313668974356
23,2,9,63000050,杭州南路1段28-1號,中華電信數據通信大樓,25.036039992718,121.524364036286
24,1,4,63000050,中華路1段39號,臺糖騰雲大樓,24.81807300114,120.995238461064
25,2,1,63000050,武昌街1段16及22巷一帶,城中市場,,
26,1,4,63000050,忠孝西路1段38號,凱撒飯店,25.046207618455,121.516424362323
27,2,4,63000050,忠孝西路1段66號,新光人壽摩天大樓 ,25.046225807185,121.515302025487
28,2,4,63000050,忠孝西路1段50號,亞洲廣場,25.04622798648,121.515826984083
29,1,6,63000050,公園路52號,臺北大眾捷運股份有限公司淡水信義線臺大醫院站,43.77707725,143.61268116
30,2,6,63000050,忠孝西路1段50-1號B1,臺北市站前地下街,25.046258999522,121.515826984083
31,2,6,63000050,寶慶路32-1號,臺北大眾捷運股份有限公司板南線西門站,22.3197515,114.1606459
32,2,5,63000050,新生南路1段124-3號1-4樓,大園老人養護所,25.037519985362,121.532462966411
33,2,5,63000050,新生南路1段124-3號5樓,仁泰老人養護所,25.037519985362,121.532462966411
34,2,9,63000050,晉江街一帶,磚木造平房,25.02635197948,121.521147983857
35,2,9,63000050,永春街一帶,磚木造平房,23.952498000093,120.577667970479
36,2,9,63000050,詔安街一帶,磚木造平房,25.025049751083,121.515523426328
37,2,4,63000050,仁愛路1段50號,交通部交通通訊傳播大樓,25.038088990859,121.524666958267
38,2,9,63000050,忠孝西路1段7號,中央住商辦公大樓,25.045999998714,121.519154012911
39,1,9,63000050,重慶南路1段99號,世界大樓,25.043040013426,121.513371002634
40,1,9,63000050,許昌街17號,壽德大樓,25.045746990966,121.516972035876
41,2,9,63000050,林森南路(仁愛路1段至羅斯福路1段),林森南路車行地下道,,
42,1,9,63000050,惠安街17號地下一樓,集合住宅,,
43,2,9,63000050,羅斯福路四段136巷3號,東南亞秀泰影城,25.012993417934,121.535845523336
44,2,9,63000050,中華路二段315巷5弄,南機場夜市,25.02967669457,121.505436160873
45,2,5,63000080,羅斯福路6段280號,景美醫院,24.991154985033,121.539770980151
46,1,5,63000080,溪口街1巷5號3、4樓,美安老人長期照顧中心,,
47,2,5,63000080,辛亥路5段120-1號1-4樓,心慈老人養護所,24.99752749456,121.552212993406
48,2,9,63000080,辛亥路5段至6段,懷恩隧道,24.999886458569,121.553960018835
49,2,9,63000080,萬芳交流道至信義路5段150巷,文山隧道,,
50,2,4,63000080,木柵路3段177號B5至24樓,遠雄日光,24.989791584662,121.56946479416
51,1,5,63000080,車前路12號3至4樓,三園老人長期照顧中心,24.991535984441,121.540956013622
52,2,5,63000080,木柵路3段85巷8弄4-1、4-2號1樓及2、2-1、2-2、4、4-1、4-2號2樓,臺北市私立吉祥老人長期照顧中心(養護型),,
53,2,9,63000080,興隆路3段185及207巷,來來社區,,
54,2,5,63000080,木柵路2段163、165號2-4樓,慧誠老人養護所,,
55,1,9,63000080,景興路,仙跡岩集合住宅,24.992261135246,121.544043023281
56,2,9,63000080,景興路153巷,景興路集合住宅,,
57,2,9,63000080,羅斯福路6段403號B1,總動員KTV(好樂迪),24.991878008,121.540664993944
58,1,5,63000080,溪口街1巷5號,景安老人養護所,,
59,2,5,63000080,興隆路2段95巷8號3至5樓,臺北市私立文山老人養護所,24.998589020687,121.54524302182
60,2,9,63000080,秀明路2段115巷1至13號,翡翠城堡社區大廈,,
61,2,5,63000080,萬和街6號8號5樓,創世基金會植物人安養中心文山分會,25.001968017315,121.567324978098
62,2,5,63000080,興隆路4段109巷30號4樓,臺北市政府社會局老人自費安養中心,,
63,2,5,63000080,政大二街129號,兆如老人養護中心,24.9893147801,121.584193306781
64,2,2,63000080,試院路144巷及154巷一帶,集合住宅,,
65,2,4,63000080,辛亥路6段21巷2至40號,發現之旅社區大廈,,
66,2,5,63000080,景興路222號3樓,景興老人長期照顧中心,,
67,2,9,63000080,羅斯福路5段172-1號B1,易儲居企業有限公司,25.004291983789,121.538479999424
68,2,9,63000080,羅斯福路4段200號2樓,獅子王企業股份有限公司,25.010785486088,121.536902525247
69,2,9,63000070,成都路81號3樓,聚歡暢文化有限公司,24.275684614794,120.651893578773
70,2,9,63000070,漢口街2段54號,六福大樓,25.04578739174,121.505939272002
71,2,5,63000070,廣州街243號,仁濟醫院,23.130196401,113.2592945
72,1,6,63000070,和平西路3段與西園路1段間,捷運龍山寺站暨地下商場,37.04944539,140.21413035
73,2,5,63000070,峨眉街124-1號,中山老人安養中心,,
74,1,9,63000070,西昌街（桂林街以南、廣州街以北）,西昌夜市,27.89642,102.26341
75,1,9,63000070,廣州街（西園路1段以西、環河南路以東）,艋舺夜市及廣州夜市,23.130196401,113.2592945
76,1,5,63000070,柳州街41號4樓,育仁啟能中心,22.672010996692,120.480818012953
77,1,9,63000070,西寧南路4號,西寧行政大樓及西寧市場,25.047933997143,121.507047024326
78,1,8,63000070,西寧南路70號,萬年商業大樓,25.043491001727,121.506046979458
79,1,8,63000070,漢中街52號,萬國百貨,22.756894991154,121.138279997342
80,1,8,63000070,峨嵋街52號,誠品百貨-西門店,,
81,1,8,63000070,漢中街116號,H&M成衣公司,33.069048999,107.018889
82,2,9,63000070,西園路2段52巷14弄以西與16弄以東所圍街廓及西園路2段52巷17號以東、西園路2段52巷14弄2號以西、西園路2段50巷4弄以南、西園路2段52巷以北所圍街廓,傳統市場,,
83,2,9,63000070,青年路106號,南機場三號基地國宅,36.84092,115.71087
84,1,9,63000070,萬華區成都路110號,成都大樓,25.043646988945,121.501810011222
85,1,8,63000070,武昌街2段77號,誠品百貨-武昌店,25.045092992971,121.505730981708
86,1,4,63000070,西寧南路127號,阿曼TIT,25.044437989148,121.506567998559
87,1,9,63000070,西昌街188、190號B1樓,地下層蝸居,27.89642,102.26341
88,2,9,63000070,中華路二段336號,忠恕社區連棟式集合住宅,22.743120003838,121.135128988482
89,2,9,63000070,萬華區漢中街42號6樓,金元寶餐廳(歌廳),25.04421700027,121.50734097767
90,2,9,63000070,萬華區漢口街2段54號3樓,相思園餐坊(卡拉ok),25.04578739174,121.505939272002
91,2,9,63000070,萬華區漢中街42號7樓,星光百分百餐廳(歌廳 ),25.04421700027,121.50734097767
92,2,9,63000070,萬華區峨眉街5號2樓,新櫻花音樂茶坊,25.043387904318,121.50801018882
93,2,9,63000070,萬華區漢口街2段54號2樓之13,皇鳳餐廳(歌廳),25.04578739174,121.505939272002
94,2,9,63000070,萬華區漢口街2段54號3F樓,舞帝有限公司,25.04578739174,121.505939272002
95,2,9,63000070,萬華區武昌街2段89號5樓,映捌玖數位影城有限公司,25.045494989048,121.50402199547
96,2,9,63000070,萬華區中華路1段144號9樓,新世界音樂城(歌廳),25.043149481082,121.508151675345
97,2,9,63000070,萬華區西寧南路70號9樓,萬歲企業有限公司(MTV),25.043491001727,121.506046979458
98,2,9,63000070,萬華區漢口街2段54號2樓,亞洲舞廳,25.04578739174,121.505939272002
99,2,9,63000070,西昌街201之2號B1-5樓,住宅(蝸居),27.89642,102.26341
100,2,9,63000070,萬華區漢中街116號7樓,中影股份有限公司真善美分公司,25.042807415613,121.507480703996
101,2,9,63000070,萬華區成都路13號8樓,僖友國際股份有限公司(舞廳),25.042720495277,121.507368889408
102,2,9,63000070,萬華區西寧南路36號4樓,新光三越百貨股份有限公司獅子林分公司(新光影城),25.04563500874,121.506617032693
103,2,9,63000070,萬華區武昌街2段89號1至4樓,豪華大戲院股份有限公司,25.045494989048,121.50402199547
104,2,9,63000070,漢中街52號8至11樓,絕色影城股份有限公司(台北西門威秀影城),22.756894991154,121.138279997342
105,2,9,63000070,萬華區成都路88號1至7樓,國賓企業股份有限公司(電影院),25.042997014263,121.504539997086
106,2,9,63000070,萬華區武昌街2段85號1樓,樂聲大戲院股份有限公司,25.045268719571,121.504860688702
107,2,8,63000070,萬華區西寧南路36號1F-3F樓,獅子林商場,25.04563500874,121.506617032693
108,2,9,63000070,和平西路三段187號2樓,金巴黎風味軒餐廳,25.035483979171,121.497700028819
109,2,9,63000070,漢口街二段54號3樓,夜上海有限公司,25.04578739174,121.505939272002
110,2,9,63000070,漢口街二段55號B1樓,好聚點茶坊,25.045915006216,121.506176982776
111,2,9,63000070,漢口街二段37號1樓,東方足體養生館有限公司,25.045678007903,121.50731499377
112,2,9,63000070,東園街135號,東園市,34.18098318,131.52839778
113,2,2,63000030,和平東路3段606巷及632巷底,違章建築住宅,37.04944539,140.21413035
114,2,4,63000030,忠孝東路3段265號,朕廈社區,25.041835911126,121.542377500582
115,2,4,63000030,敦化南路2段201至209號,遠企大樓場所(併鼎鼎大飯店),43.36954,128.22861
116,1,5,63000030,仁愛路4段112巷11號,中山醫院,,
117,2,9,63000030,和平東路3段636巷167號,臺和實業股份有限公司,37.04944539,140.21413035
118,1,5,63000030,仁愛路4段266巷6號,國泰醫院,,
119,2,1,63000030,基隆路3段155巷,空軍眷村,25.01582758423,121.542950275141
120,1,5,63000030,仁愛路4段10號,仁愛醫院,25.03754001811,121.545302281876
121,1,5,63000030,忠孝東路4段77號,中心診所,25.041882011593,121.547346963336
122,1,5,63000030,仁愛路4段61號,宏恩醫院,25.038178006671,121.546684038614
123,1,6,63000030,忠孝東路、復興南路口,捷運板南線忠孝復興站,,
124,1,6,63000030,忠孝東路、敦化南路地下街,捷運板南線地下街,,
125,1,9,63000030,信義路4段60號,信維市場,25.033190179188,121.545718535539
126,1,9,63000030,信義路4段2號,捷運木柵線及信義線大安站,25.033102009927,121.543986993629
127,2,9,63000030,和平東路3段底,莊敬隧道,25.010764895096,121.56418193045
128,2,9,63000030,和平東路1段177號,和平大廈,25.026517019154,121.532222992523
129,2,1,63000030,羅斯福路4段119巷60弄,老舊建築,25.009426824164,121.53872395228
130,2,7,63000030,通化街39巷49弄12號,珍珠細道立體停車塔,25.031083018999,121.555482019463
131,2,7,63000030,忠孝東路4段205巷38號,台灣聯通停車場-建安場,,
132,2,7,63000030,光復南路676巷16號,莎軒住商大樓立體停車塔,,
133,1,9,63000030,忠孝東路4段201號,統領商業大樓,25.04167799607,121.551773865498
134,1,5,63000030,忠孝東路4段116巷1-5號,秀傳醫院,,
135,2,1,63000030,基隆路3段155巷107弄,台大教職員宿舍,,
136,1,6,63000030,信義路2段166號,捷運東門站,25.033692682643,121.529438859564
137,2,7,63000030,信義路4段265巷17-1號,昌軒小君悅立體停車塔,34.98868348,137.17707059
138,1,5,63000030,基隆路3段155巷57號,台大癌醫中心,,
139,2,7,63000020,光復南路567號,愛馬屋停車塔,25.03075398739,121.557622003163
140,2,4,63000020,松仁路32、36、38號,新光金融大樓,,
141,1,4,63000020,忠孝東路5段6、8號,市政府轉運站暨統一時代百貨公司,25.040864993371,121.565417005478
142,1,9,63000020,松仁路38號,寒舍艾美酒店,,
143,2,9,63000020,永吉路443、491巷一帶,五分埔成衣商店街,34.875,137.08420256
144,2,2,63000020,褔德街221巷,集合住宅,,
145,2,9,63000020,紫雲街22-26號,挹翠山莊RC住宅,,
146,2,9,63000020,崇德街200號以上,平房住宅,,
147,2,4,63000020,信義路5段150巷8號,雲鼎大樓,34.98868348,137.17707059
148,2,4,63000020,忠孝東路5段508至510號,家美國際金融大樓,,
149,2,4,63000020,基隆路1段200號,遠雄大樓,25.040179018416,121.563538034243
150,2,4,63000020,基隆路2段189號,文普世紀天廈,25.024798812822,121.553269197025
151,2,4,63000020,基隆路1段206號,點石大樓及瀚寓酒店,25.039826685116,121.563340724243
152,2,4,63000020,基隆路1段333號,國際貿易大樓,25.034254982618,121.561112982017
153,2,4,63000020,松德路151號,福爾摩沙大廈,,
154,1,4,63000020,松壽路2號,君悅大飯店,25.035744991636,121.562584006024
155,2,4,63000020,松德路94號,國際名紳大廈,25.037936985045,121.575260964024
156,2,4,63000020,信義路5段150巷2號,環球世貿大樓,34.98868348,137.17707059
157,2,4,63000020,松德路93至127號,凱夏社區大樓,,
158,2,4,63000020,松德路171號,僑泰首席大樓,,
159,1,4,63000020,信義路5段7號、市府路45號,臺北101大樓,25.033524206389,121.56460396087
160,2,4,63000020,信義路4段460至466號,信基大樓,34.98868348,137.17707059
161,2,4,63000020,信義路4段456至458號,世紀金融廣場,34.98868348,137.17707059
162,2,4,63000020,松仁路3號,中油大樓,,
163,2,4,63000020,松仁路7號,國泰金融大樓,,
164,1,5,63000020,吳興街252號,臺北醫學大學附設醫院,,
165,2,5,63000020,信義路6段15巷16號1樓,臺北市私立康庭老人養護所,34.98868348,137.17707059
166,2,5,63000020,中坡北路21號1-2樓、23號2樓,臺北市私立倚青苑老人養護所,25.04489400659,121.580791008464
167,2,5,63000020,松隆路36號6樓,恆愛發展中心,25.043462000342,121.567580961421
168,1,9,63000020,松山路11號,松山火車站暨潤泰百益股份有限公司,25.048455980163,121.578251962354
169,1,5,63000020,松德路309號,臺北市立療養院,,
170,2,9,63000020,菸廠路88號,松山菸廠-誠品生活股份有限公司松山分公司,25.044738019372,121.561108958703
171,2,6,63000020,忠孝東路4段400號,捷運板南線國父紀念館站,25.04113438774,121.557900533806
172,2,6,63000020,忠孝東路5段、虎林街口(忠孝東路5段455號),捷運板南線永春站,,
173,1,6,63000020,忠孝東路5段、基隆路口,捷運板南線市政府站,,
174,1,8,63000020,忠孝東路5段297號,"七品餐坊七品餐坊
(含KTV SING!GO)",25.041146709137,121.572849406662
175,2,8,63000020,松壽路11號,新光三越百貨公司A11館,25.036023983283,121.567235962286
176,2,8,63000020,松高路12號,新光三越百貨公司A8館,25.038813019655,121.566799013674
177,1,8,63000020,松壽路12號,"ATT 4 FUN
(含KTV SING!GO)",25.035689000523,121.565997033178
178,1,9,63000020,信義路5段1號,臺北國際會議中心,25.033179081526,121.560848532971
179,1,9,63000020,信義路5段5號,世貿展覽中心,25.033182979111,121.562327016873
180,2,9,63000020,吳興街600巷,吳興街狹小巷道,,
181,2,9,63000020,信義路5段,信義快速道路(象山隧道),25.032811724481,121.567192348262
182,2,8,63000020,松高路19號,新光三越百貨公司A4館,25.039359016828,121.56666599287
183,2,4,63000020,松高路9、11號,統一國際大樓,,
184,2,9,63000020,信義路4段375號,玫瑰欣欣大樓,25.033358999078,121.557806991766
185,2,9,63000020,基隆路2段22號,惠安大樓,25.031936296742,121.558728330563
186,2,9,63000020,基隆路1段432號,雙雄世貿大樓,25.033701986556,121.55968001185
187,2,9,63000020,基隆路2段109號B1,好樂迪KTV,25.02901398811,121.557390997912
188,2,4,63000020,松智路1號,華新麗華大樓,25.038774714358,121.566081941857
189,2,8,63000020,松仁路28號,震怡股份有限公司,,
190,1,8,63000020,松壽路22號,NEO19,25.03556540936,121.56773426643
191,2,4,63000020,信義路5段95號,冠德遠見大樓,25.033161186163,121.572013479458
192,2,4,63000020,信義路5段91巷2號,寶徠花園廣場社區,25.032926395932,121.571467408302
193,2,8,63000020,松壽路9號,新光三越A9館,25.036029012425,121.566647971778
194,1,4,63000020,忠孝東路5段10號,時代飯店,25.040689979233,121.566010025128
195,2,9,63000020,信義路5段(松仁路至松德路段),信義車行地下道,25.039292003512,121.577696996544
196,1,4,63000020,松高路16、18號,富邦信義商旅大樓(含寒舍國際酒店股份有限公司及微風置地股份有限公司松高分公司),,
197,2,9,63000020,逸仙路26巷1號B1,收多易股份有限公司,,
198,2,4,63000020,松勇路69巷2號,臺北信義社區,,
199,2,7,63000020,富陽街57號,名人居-停車塔,25.022174983761,121.556515005211
200,2,4,63000020,松仁路123號,華南銀行總行大樓,,
201,2,4,63000020,松高路1號,遠雄金融中心,25.039542999603,121.563946987299
202,2,7,63000020,忠孝東路5段15巷15號,筌壹企業股份有限公司停車場(停車塔),25.041521003024,121.564995982482
203,2,7,63000020,光復南路439號,仁愛PAGE 1大樓(停車塔),25.035663980542,121.557684029247
204,2,7,63000020,信義路4段450巷1號,愛馬屋101場(停車塔),34.98868348,137.17707059
205,2,4,63000020,松勇路53巷21號,文心信義大樓,,
206,2,4,63000020,松智路17號,南山人壽保險股份有限公司(南山廣場),25.034570519363,121.565939784779
207,2,4,63000020,忠孝東路5段68號,國泰置地廣場暨信義微風百貨,25.040647902079,121.566693904608
208,2,8,63000020,松仁路58號,遠東百貨A13,,
209,2,4,63000020,松高路77號,富邦信義大樓A棟,25.039205247516,121.56648045605
210,2,9,63000020,松壽路12號10樓,唯優餐飲有限公司,25.035689000523,121.565997033178
211,2,9,63000020,松壽路22號B1樓,樂三實業股份有限公司(UNDERLINK),25.03556540936,121.56773426643
212,1,9,63000020,忠孝東路4段515號,臺北文化體育園區,25.041892991886,121.545321979348
213,2,4,63000090,南港路3段47巷55號,潤泰玉成總部辦公大樓,,
214,2,9,63000090,中南街1號2樓,中南街1號2樓,24.801449004934,120.967771970186
215,1,6,63000090,忠孝東路7段380號,捷運板南線南港站,25.051856183005,121.606525965783
216,1,5,63000090,同德路87號,忠孝醫院,25.046511001441,121.586152995744
217,2,9,63000090,南港路1段32號,捷運文湖線南港展覽館站,25.055314011432,121.617606003591
218,1,9,63000090,三重路19號,南港經貿園區,24.765606017208,121.058986019836
219,2,2,63000090,中南街134巷內,老舊社區,35.18810364,135.46971011
220,2,9,63000090,研究院路3段161巷3號,六韜瓦斯分裝場,25.033910527586,121.613429454374
221,1,9,63000090,經貿二路1號,台北世貿南港展覽館,25.056358983301,121.617326970034
222,2,9,63000090,研究院路1段99號,太陽大帝住商大廈,25.052304908192,121.61637160071
223,1,9,63000090,南港區研究院路2段128號內之(化學研究所) ,中央研究院,25.042019600534,121.616663458579
224,2,6,63000090,研究院路1段1號,捷運南港展覽館站,25.054857910171,121.61683042609
225,1,4,63000090,園區街3號,南港軟體工業園區第二期大樓,25.058478515157,121.611986691883
226,1,9,63000090,三重路66號,南港軟體工業園區第三期大樓,25.057241010972,121.614385005838
227,1,9,63000090,南港路1段313、315號,南港火車站及高鐵站,,
228,1,9,63000090,忠孝東路7段359~369號,南港車站辦公大樓、潤泰南港車站商場及六福萬怡酒店,,
229,1,9,63000090,經貿二路2號,南港展覽館二館,24.188434995799,120.662094019662
230,2,7,63000090,研究院路1段101巷10號,大哲悅社區停車塔,,
231,2,4,63000100,內湖路2段103巷16號,勤美璞真碧湖畔,,
232,2,4,63000100,成功路4段178至180號,雙湖匯大樓,,
233,2,4,63000100,內湖路3段72巷61號,森之林大廈,,
234,2,4,63000100,星雲街168巷29至43號,力霸國鼎大廈,,
235,2,4,63000100,星雲街150巷26至32號,大成大賞公寓大廈,,
236,2,4,63000100,成功路2段365號,現代米羅大廈,25.073683999979,121.590119982879
237,2,4,63000100,瑞光路392號,光寶科技大樓,34.75194575,135.54322999
238,2,5,63000100,成功路2段325號,三軍總醫院,25.07092501273,121.590532959248
239,2,5,63000100,成功路3段88、90號2樓及76巷9號2樓,臺北市私立瑞安老人養護所,,
240,2,5,63000100,成功路2段488號2.3樓及490號2樓,臺北市私立銀髮族老人養護所,25.073275005013,121.589704994853
241,2,8,63000100,新湖三路23號,特力屋廣場,25.062029005523,121.574170981336
242,2,8,63000100,舊宗路1段128號,宜家家居股份有限公司-內湖分公司,25.060962995077,121.578320526322
243,2,8,63000100,舊宗路1段268號,好市多大賣場,25.063985383634,121.576115079958
244,2,8,63000100,舊宗路1段188號,大潤發大賣場二館,25.062884001556,121.576944972191
245,2,8,63000100,堤頂大道1段331號,燦坤3C賣場,25.06270798159,121.572944038349
246,2,9,63000100,民權東路6段180巷42弄6號,婦幼家園,,
247,2,4,63000100,民權東路6段296巷76、82至90號,大湖亭閣,,
248,2,5,63000100,民權東路6段280巷19弄1至7號1樓,臺北市私立童音老人養護所,,
249,2,5,63000100,陽光街72-1號1樓,私立文德老人養護所,,
250,2,5,63000100,成功路5段420巷26-28號,康寧醫院,,
251,2,8,63000100,民善街88號,家樂福大賣場,25.060040985728,121.575388033677
252,2,8,63000100,民善街205號,禮客時尚館,,
253,2,4,63000100,堤頂大道路2段235-241號,精英大樓,,
254,2,4,63000100,金湖路79號,輝煌世紀,25.081439397801,121.596844029425
255,2,9,63000100,成功路4段32號至58號、成功路4段30巷7號至21號及47號至53號,宏泰巨星,25.081711013374,121.591655966636
256,2,5,63000100,內湖路2段360號,中國醫藥大學附設臺北分院,25.082078015004,121.590630021687
257,2,5,63000100,內湖路2段253巷1弄3號B1至2樓,臺北市私立祥家老人養護所,,
258,2,9,63000100,內湖路1段256號,捷運內湖線西湖站,25.081982000303,121.567292959228
259,2,9,63000100,內湖路1段663號,捷運內湖線港漧站,25.080146279689,121.575649800513
260,2,9,63000100,文德路214號,捷運內湖線文德站,,
261,2,9,63000100,成功路4段143號,捷運內湖線內湖站,25.082803007719,121.593619008359
262,2,9,63000100,成功路5段11號,捷運內湖線大湖公園站,25.083322979083,121.602623016388
263,2,9,63000100,康寧路3段16號,捷運內湖線葫洲站,25.072558813297,121.607120577994
264,2,9,63000100,康寧路3段235號,捷運內湖線東湖站,25.067113006984,121.611611014982
265,2,5,63000100,金龍路136-1號B2-6樓,金龍發展中心,22.2901203,114.2380383
266,2,9,63000100,星雲街16巷63號至69號,馬蒂斯小丘社區,,
267,2,9,63000100,成功路2段456巷1號,大台北瓦斯-成功基地,,
268,2,9,63000100,大湖街121號,東宜瓦斯行,30.460769899,116.3193438
269,2,9,63000100,大湖街125號,欣湖瓦斯行,30.460769899,116.3193438
270,2,4,63000100,環山路1段26號,上林苑社區,25.084878995588,121.564527014999
271,2,4,63000100,成功路4段91號,基泰御峰,25.082479005252,121.59311601035
272,2,9,63000100,舊宗路二段105號3樓,摩爾空間個人倉庫（內科店）,25.068626988245,121.575142192456
273,1,9,63000100,民權東路6段296巷121號B2,摩爾空間個人倉庫（東湖店）,,
274,2,9,63000100,成功路5段2號B1,台灣便利倉（內湖倉）,25.084746980613,121.600877987966
275,2,4,63000100,內湖路1段411巷66號,長虹天璽大廈,,
276,2,4,63000100,金湖路125號,文心AIT,33.018345299,119.0136509
277,2,9,63000100,內湖路3段60巷27號,安縵莊園,,
278,2,9,63000100,成功路4段68號B1樓,好樂迪股份有限公司內湖分公司,25.082720487883,121.592866481092
279,2,9,63000100,成功路4段68號B2樓,好手撞球運動館,25.082720487883,121.592866481092
280,2,8,63000100,成功路4段188至192號 ,潤泰京采大樓,,
281,2,9,63000100,康寧路3段72號3、4樓,哈拉影城,25.070210204027,121.611273727199
282,2,4,63000100,文德路210巷30弄81號至91號,新光碧湖天大廈,25.077103350675,121.585083768567
283,2,4,63000100,內湖區潭美街533~539號,長虹雲端科技大樓,25.061104020598,121.599412998929
284,2,9,63000100,內湖區成功路4段358號B1,台灣便利倉內湖二店,25.084868099114,121.600036361068
285,2,4,63000100,新明路428巷1號,翔譽愛力大樓,38.42385701,141.03760735
286,2,5,63000100,行善路250號,臺北市立行愛住宿長照機構,,
287,2,4,63000010,敦化北路6號,華固名鑄,25.050390020502,121.548572984314
288,2,4,63000010,市民大道4段39-2號,潤泰敦峰,25.045151040842,121.54482190837
289,2,2,63000010,濱江街457 巷至6號水門,濱江街一帶(6號水門以西至濱江街457巷),,
290,2,3,63000010,民生東路3段156號,宏泰世紀大樓地下室,25.057436015949,121.54771803019
291,2,3,63000010,南京東路3段337號,微風百貨南京店,25.052017995646,121.548031010455
292,2,4,63000010,民生東路5段198~206號,建成花園大廈,,
293,2,5,63000010,南京東路5段162號3樓,私立佳安康復中心,25.051222008211,121.563078035397
294,1,5,63000010,健康路131號,國軍松山醫院,,
